Question,Answer,Wrong 1,Wrong 2,Wrong 3,Link
What year was the first space walk?,1965,1967,1960,1984,https://www.youtube.com/watch?v=6AviDjR9mmo 
What term is used for putting on a spacesuit?,Donning,Climbing,Filling,Rigging,https://www.youtube.com/watch?v=6AviDjR9mmo 
What term is used for taking off a spacesuit?,Doffing,Throwing,Peeling,Casting,https://www.youtube.com/watch?v=6AviDjR9mmo 
"For Artemis missions, which space suit is worn while walking on the moon?",The xEMU Exploration Extravehicular Mobility Unit,The Auxillary Extravehicular Unit,The Extrasensory Mobility Unit,The Spacial Flight Suit,https://www.youtube.com/watch?v=6AviDjR9mmo 
What is the new space suit worn during the launch and entry of Orion spacecraft?,The Orion Survival Suit,Saturn Flight Suit,Artemis Launch Suit,Apollo Survival Suit,https://www.youtube.com/watch?v=6AviDjR9mmo 
Why are the Orion Crew Survival Suits orange and not blue?,For better visibility during search-and-rescue to retrieve the crew,Orange represents progress,Orion mission colors are orange,In honor of the Apollo missions,https://www.youtube.com/watch?v=6AviDjR9mmo 
